{
  "schema_version": 2,
  "run_id": "controlled-2026-09-02T08-53-02-016Z",
  "recorded_at": "2026-09-02T08:53:02.016Z",
  "environment": {
    "machine": "darwin arm64",
    "os_release": "25.6.0",
    "node": "v22.23.1",
    "chrome": "Chrome/152.0.7977.65",
    "drawmcp_commit": "8a2eb7fd26407c5382d018f49ffde6c7f5fe2a8c",
    "drawmcp_dirty": false,
    "excalidraw_mcp_commit": "157aa23ceb1976008aadc89eb05e3444060f09d6"
  },
  "method": {
    "stratum": "controlled-local",
    "random_seed": 20260902,
    "warm_pairs": 100,
    "cold_pairs": 10,
    "discarded_warmup_pairs": 1,
    "order": "seeded randomized AB/BA",
    "webmcp_task_boundary": "Puppeteer WebMCP add_elements plus fit_to_content completion on a mounted local page; component time is the sum of page PerformanceMeasure entries.",
    "official_mcp_task_boundary": "Streamable HTTP create_view completion on the pinned local server; checkpoint read is an untimed semantic oracle and widget render is excluded.",
    "comparability": "Task semantics and local machine are controlled. Component durations contain different work and are not an end-to-end protocol ranking."
  },
  "scenario": {
    "path": "benchmarks/scenarios/architecture-diagram.json",
    "name": "Browser-Agent-Canvas architecture",
    "required_nodes": 3,
    "required_edges": 2,
    "official_registered_tools": [
      "read_me",
      "create_view",
      "export_to_excalidraw",
      "save_checkpoint",
      "read_checkpoint"
    ],
    "official_model_visible_tools": [
      "read_me",
      "create_view"
    ]
  },
  "trials": [
    {
      "stratum": "controlled-local",
      "trial": 1,
      "lane": "webmcp",
      "order": "A",
      "cold_start": false,
      "completed": true,
      "semantic_pass": true,
      "task_duration_ms": 24.233166999999867,
      "component_duration_ms": 22.700000002980232,
      "tool_calls": 2,
      "input_bytes": 744,
      "output_bytes": 571,
      "failure": null,
      "semantic_evaluation": {
        "ok": true,
        "score": 1,
        "checks": 5,
        "passed": 5,
        "failures": []
      },
      "measures": [
        {
          "name": "drawmcp:add_elements",
          "duration_ms": 22.600000008940697
        },
        {
          "name": "drawmcp:fit_to_content",
          "duration_ms": 0.09999999403953552
        }
      ]
    },
    {
      "stratum": "controlled-local",
      "trial": 1,
      "lane": "official-mcp",
      "order": "B",
      "cold_start": false,
      "completed": true,
      "semantic_pass": true,
      "task_duration_ms": 4.5808750000001055,
      "component_duration_ms": 4.5808750000001055,
      "tool_calls": 1,
      "input_bytes": 1181,
      "output_bytes": 897,
      "failure": null,
      "oracle_calls": 1,
      "semantic_evaluation": {
        "ok": true,
        "score": 1,
        "checks": 5,
        "passed": 5,
        "failures": []
      }
    },
    {
      "stratum": "controlled-local",
      "trial": 2,
      "lane": "official-mcp",
      "order": "A",
      "cold_start": false,
      "completed": true,
      "semantic_pass": true,
      "task_duration_ms": 2.746708000000126,
      "component_duration_ms": 2.746708000000126,
      "tool_calls": 1,
      "input_bytes": 1181,
      "output_bytes": 897,
      "failure": null,
      "oracle_calls": 1,
      "semantic_evaluation": {
        "ok": true,
        "score": 1,
        "checks": 5,
        "passed": 5,
        "failures": []
      }
    },
    {
      "stratum": "controlled-local",
      "trial": 2,
      "lane": "webmcp",
      "order": "B",
      "cold_start": false,
      "completed": true,
      "semantic_pass": true,
      "task_duration_ms": 31.573249999999916,
      "component_duration_ms": 29.599999994039536,
      "tool_calls": 2,
      "input_bytes": 744,
      "output_bytes": 571,
      "failure": null,
      "semantic_evaluation": {
        "ok": true,
        "score": 1,
        "checks": 5,
        "passed": 5,
        "failures": []
      },
      "measures": [
        {
          "name": "drawmcp:add_elements",
          "duration_ms": 29.400000005960464
        },
        {
          "name": "drawmcp:fit_to_content",
          "duration_ms": 0.19999998807907104
        }
      ]
    },
    {
      "stratum": "controlled-local",
      "trial": 3,
      "lane": "official-mcp",
      "order": "A",
      "cold_start": false,
      "completed": true,
      "semantic_pass": true,
      "task_duration_ms": 4.682667000000038,
      "component_duration_ms": 4.682667000000038,
      "tool_calls": 1,
      "input_bytes": 1181,
      "output_bytes": 897,
      "failure": null,
      "oracle_calls": 1,
      "semantic_evaluation": {
        "ok": true,
        "score": 1,
        "checks": 5,
        "passed": 5,
        "failures": []
      }
    },
    {
      "stratum": "controlled-local",
      "trial": 3,
      "lane": "webmcp",
      "order": "B",
      "cold_start": false,
      "completed": true,
      "semantic_pass": true,
      "task_duration_ms": 33.50141699999995,
      "component_duration_ms": 31.700000002980232,
      "tool_calls": 2,
      "input_bytes": 744,
      "output_bytes": 571,
      "failure": null,
      "semantic_evaluation": {
        "ok": true,
        "score": 1,
        "checks": 5,
        "passed": 5,
        "failures": []
      },
      "measures": [
        {
          "name": "drawmcp:add_elements",
          "duration_ms": 31.5
        },
        {
          "name": "drawmcp:fit_to_content",
          "duration_ms": 0.20000000298023224
        }
      ]
    },
    {
      "stratum": "controlled-local",
      "trial": 4,
      "lane": "webmcp",
      "order": "A",
      "cold_start": false,
      "completed": true,
      "semantic_pass": true,
      "task_duration_ms": 33.64591699999983,
      "component_duration_ms": 32,
      "tool_calls": 2,
      "input_bytes": 744,
      "output_bytes": 571,
      "failure": null,
      "semantic_evaluation": {
        "ok": true,
        "score": 1,
        "checks": 5,
        "passed": 5,
        "failures": []
      },
      "measures": [
        {
          "name": "drawmcp:add_elements",
          "duration_ms": 31.700000002980232
        },
        {
          "name": "drawmcp:fit_to_content",
          "duration_ms": 0.29999999701976776
        }
      ]
    },
    {
      "stratum": "controlled-local",
      "trial": 4,
      "lane": "official-mcp",
      "order": "B",
      "cold_start": false,
      "completed": true,
      "semantic_pass": true,
      "task_duration_ms": 3.650000000000091,
      "component_duration_ms": 3.650000000000091,
      "tool_calls": 1,
      "input_bytes": 1181,
      "output_bytes": 897,
      "failure": null,
      "oracle_calls": 1,
      "semantic_evaluation": {
        "ok": true,
        "score": 1,
        "checks": 5,
        "passed": 5,
        "failures": []
      }
    },
    {
      "stratum": "controlled-local",
      "trial": 5,
      "lane": "official-mcp",
      "order": "A",
      "cold_start": false,
      "completed": true,
      "semantic_pass": true,
      "task_duration_ms": 3.533541000000241,
      "component_duration_ms": 3.533541000000241,
      "tool_calls": 1,
      "input_bytes": 1181,
      "output_bytes": 897,
      "failure": null,
      "oracle_calls": 1,
      "semantic_evaluation": {
        "ok": true,
        "score": 1,
        "checks": 5,
        "passed": 5,
        "failures": []
      }
    },
    {
      "stratum": "controlled-local",
      "trial": 5,
      "lane": "webmcp",
      "order": "B",
      "cold_start": false,
      "completed": true,
      "semantic_pass": true,
      "task_duration_ms": 33.903915999999754,
      "component_duration_ms": 32.30000001192093,
      "tool_calls": 2,
      "input_bytes": 744,
      "output_bytes": 571,
      "failure": null,
      "semantic_evaluation": {
        "ok": true,
        "score": 1,
        "checks": 5,
        "passed": 5,
        "failures": []
      },
      "measures": [
        {
          "name": "drawmcp:add_elements",
          "duration_ms": 32
        },
        {
          "name": "drawmcp:fit_to_content",
          "duration_ms": 0.30000001192092896
        }
      ]
    },
    {
      "stratum": "controlled-local",
      "trial": 6,
      "lane": "webmcp",
      "order": "A",
      "cold_start": false,
      "completed": true,
      "semantic_pass": true,
      "task_duration_ms": 32.07875000000013,
      "component_duration_ms": 29.899999991059303,
      "tool_calls": 2,
      "input_bytes": 744,
      "output_bytes": 571,
      "failure": null,
      "semantic_evaluation": {
        "ok": true,
        "score": 1,
        "checks": 5,
        "passed": 5,
        "failures": []
      },
      "measures": [
        {
          "name": "drawmcp:add_elements",
          "duration_ms": 29.700000002980232
        },
        {
          "name": "drawmcp:fit_to_content",
          "duration_ms": 0.19999998807907104
        }
      ]
    },
    {
      "stratum": "controlled-local",
      "trial": 6,
      "lane": "official-mcp",
      "order": "B",
      "cold_start": false,
      "completed": true,
      "semantic_pass": true,
      "task_duration_ms": 5.020790999999917,
      "component_duration_ms": 5.020790999999917,
      "tool_calls": 1,
      "input_bytes": 1181,
      "output_bytes": 897,
      "failure": null,
      "oracle_calls": 1,
      "semantic_evaluation": {
        "ok": true,
        "score": 1,
        "checks": 5,
        "passed": 5,
        "failures": []
      }
    },
    {
      "stratum": "controlled-local",
      "trial": 7,
      "lane": "webmcp",
      "order": "A",
      "cold_start": false,
      "completed": true,
      "semantic_pass": true,
      "task_duration_ms": 19.690750000000207,
      "component_duration_ms": 17.299999997019768,
      "tool_calls": 2,
      "input_bytes": 744,
      "output_bytes": 571,
      "failure": null,
      "semantic_evaluation": {